{
  "schema_version": "fyi-cli.australian-capture-capability-audit.v0.1.0",
  "recorded_at": "2026-07-26T01:45:00Z",
  "repository_revision": "382fe4b9a0321122e38ccf6a49a0c02da06bf569",
  "instance": {
    "id": "au-rtk",
    "base_url": "https://www.righttoknow.org.au",
    "country": "AU",
    "locale": "en-AU"
  },
  "jurisdictions": [
    {
      "id": "AU-CTH",
      "capture_status": "generic_alaveteli_capture_supported",
      "live_source_status": "blocked_external_access"
    },
    {
      "id": "AU-NSW",
      "capture_status": "generic_alaveteli_capture_supported",
      "live_source_status": "blocked_external_access"
    }
  ],
  "capabilities": [
    "registry-selected Alaveteli base URL",
    "request JSON capture",
    "rendered request HTML capture",
    "attachment discovery from JSON and HTML",
    "bounded transport and server-error retries",
    "byte, runtime, and disk caps",
    "content-addressed WARC and WACZ output",
    "derived request view with resource SHA-256"
  ],
  "limitations": [
    "RightToKnow origin and Internet Archive availability are external to fyi-cli",
    "AU-CTH versus AU-NSW classification requires separately recorded authority evidence",
    "a successful generic capture is not an immutable fyi-archive manifest or legal evidence"
  ],
  "live_capture_performed": false,
  "archive_handoff_status": "implementation_ready_requires_authorized_nonempty_capture",
  "prohibitions": [
    "live_capture_without_operator_authorization",
    "cross_profile_fallback",
    "infer_jurisdiction_from_request_text",
    "treat_platform_state_as_legal_evidence",
    "publication",
    "redistribution",
    "training",
    "legal_certification",
    "profile_promotion"
  ]
}
